{
  "portal_type": "mikrotik",
  "auth_method": "form_submission",
  "detection": {
    "url_patterns": [
      "*mikrotik*"
    ],
    "title_patterns": [],
    "content_patterns": []
  },
  "form_config": {
    "action": "/login",
    "method": "POST",
    "required_fields": {
      "username": "Имя пользователя",
      "password": "Пароль"
    },
    "optional_fields": {},
    "hidden_fields": {}
  },
  "success_indicators": [
    {
      "type": "internet_check",
      "value": "http://www.google.com/generate_204",
      "timeout": 10
    }
  ],
  "retry_config": {
    "max_attempts": 3,
    "delay_seconds": 5,
    "backoff_multiplier": 1.5
  },
  "timeouts": {
    "page_load": 30,
    "auth_request": 15,
    "verification": 10
  },
  "metadata": {
    "name": "Шаблон для mikrotik",
    "description": "Конфигурация для captive портала mikrotik",
    "version": "1.0.0",
    "author": "OpenWrt Captive Monitor",
    "created": "2025-12-11T21:03:33.626119",
    "tested_versions": []
  }
}